[
  {
    "id": "kiehl-arenas-bleach",
    "name": "ARENAS-bleach",
    "brand": "Kiehl",
    "gtins": [
      "04031255046754"
    ],
    "ufi": "GG70-60TK-J00T-D5M1",
    "chemicalGroups": [
      "hypochlorite",
      "caustic_lye",
      "oxidizer"
    ],
    "hazardStatements": [
      "EUH031",
      "H314",
      "H400"
    ],
    "casNumbers": [
      "7681-52-9"
    ],
    "ph": {
      "min": 13,
      "max": 13
    },
    "dataLane": "public_law",
    "sourceType": "sds",
    "provenance": {
      "sourceDocument": "Johannes Kiehl KG, Sicherheitsdatenblatt ARENAS-bleach",
      "sourceUrl": "https://www.kiehl-group.com/ix_pim_assets/doc/doc_Sicherheitsdatenblatt/j6532_sd_ARENAS-bleach_de.pdf",
      "sourceHost": "manufacturer",
      "revisionDate": "2022-12-12",
      "sha256": "6bfb2520281e650a896c94023c6ab91125e68f9bafe7b6c3abbe31a2f5b3d69e",
      "verificationDate": "2026-10-12",
      "gtinSource": "https://www.kiehl-group.com/de/PM/Produkte/Produktsortiment/Textilwaesche/Bleiche/ARENAS-bleach"
    },
    "activeIngredients": "Natriumhypochloritlösung 12 % Aktivchlor (CAS 7681-52-9)",
    "descriptionDe": "Flüssiges Bleich-Konzentrat auf Chlorbasis für die gewerbliche Textilwäsche.",
    "descriptionEn": "Liquid chlorine bleach concentrate for commercial laundry.",
    "typicalUseDe": "Bleiche in der gewerblichen Wäscherei",
    "typicalUseEn": "Bleach in commercial laundry",
    "hazardsConfirmed": true,
    "completenessReviewed": false,
    "currentVersionChecked": true,
    "reviewMetadata": {
      "hazardsConfirmed": {
        "date": "2026-10-12",
        "reviewer": "Codex document/source audit",
        "basis": "SDS identity and section 2/3/9 facts compared to the existing record; https://www.kiehl-group.com/ix_pim_assets/doc/doc_Sicherheitsdatenblatt/j6532_sd_ARENAS-bleach_de.pdf; SHA-256 6bfb2520281e650a896c94023c6ab91125e68f9bafe7b6c3abbe31a2f5b3d69e. No independent chemical-completeness or physical-container review asserted."
      },
      "currentVersionChecked": {
        "date": "2026-10-12",
        "reviewer": "Codex document/source audit",
        "basis": "Manufacturer-served document reacquired on review date; https://www.kiehl-group.com/ix_pim_assets/doc/doc_Sicherheitsdatenblatt/j6532_sd_ARENAS-bleach_de.pdf; SHA-256 6bfb2520281e650a896c94023c6ab91125e68f9bafe7b6c3abbe31a2f5b3d69e. No independent chemical-completeness or physical-container review asserted."
      }
    },
    "hazardStatementsEvidence": "documented",
    "gtinMappings": {
      "04031255046754": {
        "confirmed": true,
        "review": {
          "date": "2026-10-12",
          "reviewer": "Codex document/source audit",
          "basis": "Manufacturer-listed EAN association rechecked; https://www.kiehl-group.com/de/PM/Produkte/Produktsortiment/Textilwaesche/Bleiche/ARENAS-bleach; SHA-256 6ab3aac5ae55b0429b5ff9c6614728ef99923ee22416c0dd2300535eec9ac404. No independent chemical-completeness or physical-container review asserted."
        }
      }
    }
  },
  {
    "id": "kiehl-powerfix-gel",
    "name": "Powerfix-Gel",
    "brand": "Kiehl",
    "gtins": [
      "04031255000121",
      "04031255045931",
      "04031255045870",
      "04031255045924",
      "04031255035802"
    ],
    "ufi": "3U20-V0J5-1002-NR4J",
    "giscode": "GS80",
    "chemicalGroups": [
      "acid"
    ],
    "hazardStatements": [
      "H314",
      "H412"
    ],
    "casNumbers": [
      "7664-38-2",
      "25307-17-9"
    ],
    "ph": {
      "min": 0.5,
      "max": 0.5
    },
    "dataLane": "public_law",
    "sourceType": "sds",
    "provenance": {
      "sourceDocument": "Johannes Kiehl KG, Sicherheitsdatenblatt Powerfix-Gel",
      "sourceUrl": "https://www.kiehl-group.com/ix_pim_assets/doc/doc_Sicherheitsdatenblatt/j4006_sd_Powerfix-Gel_de.pdf",
      "sourceHost": "manufacturer",
      "revisionDate": "2022-12-12",
      "sha256": "19be7664135955b120db98e1580837a4950e475e8a2a2312d5a8fdd98d663d99",
      "verificationDate": "2026-10-12",
      "gtinSource": "https://www.kiehl-group.com/de/PM/Produkte/Produktsortiment/Gebaeude/Sanitaerreinigung/Powerfix-Gel"
    },
    "activeIngredients": "Phosphorsäure 15 – < 20 % (CAS 7664-38-2), Oleylamin, ethoxyliert 1 – < 5 % (CAS 25307-17-9)",
    "descriptionDe": "WC-Kraftreiniger auf Phosphorsäurebasis, gelförmig.",
    "descriptionEn": "Phosphoric-acid toilet power cleaner, gel.",
    "typicalUseDe": "WC-Becken und Urinale, gegen Kalk und Urinstein",
    "typicalUseEn": "Toilet bowls and urinals, against limescale and urine scale",
    "hazardsConfirmed": true,
    "completenessReviewed": false,
    "currentVersionChecked": true,
    "reviewMetadata": {
      "hazardsConfirmed": {
        "date": "2026-10-12",
        "reviewer": "Codex document/source audit",
        "basis": "SDS identity and section 2/3/9 facts compared to the existing record; https://www.kiehl-group.com/ix_pim_assets/doc/doc_Sicherheitsdatenblatt/j4006_sd_Powerfix-Gel_de.pdf; SHA-256 19be7664135955b120db98e1580837a4950e475e8a2a2312d5a8fdd98d663d99. No independent chemical-completeness or physical-container review asserted."
      },
      "currentVersionChecked": {
        "date": "2026-10-12",
        "reviewer": "Codex document/source audit",
        "basis": "Manufacturer-served document reacquired on review date; https://www.kiehl-group.com/ix_pim_assets/doc/doc_Sicherheitsdatenblatt/j4006_sd_Powerfix-Gel_de.pdf; SHA-256 19be7664135955b120db98e1580837a4950e475e8a2a2312d5a8fdd98d663d99. No independent chemical-completeness or physical-container review asserted."
      }
    },
    "hazardStatementsEvidence": "documented",
    "gtinMappings": {
      "04031255000121": {
        "confirmed": true,
        "review": {
          "date": "2026-10-12",
          "reviewer": "Codex document/source audit",
          "basis": "Manufacturer-listed EAN association rechecked; https://www.kiehl-group.com/de/PM/Produkte/Produktsortiment/Gebaeude/Sanitaerreinigung/Powerfix-Gel; SHA-256 5cb288d4a40aeb3c6b0657f1e9207958696fb5eeffc90dc5bc36531389348f92. No independent chemical-completeness or physical-container review asserted."
        }
      },
      "04031255045931": {
        "confirmed": true,
        "review": {
          "date": "2026-10-12",
          "reviewer": "Codex document/source audit",
          "basis": "Manufacturer-listed EAN association rechecked; https://www.kiehl-group.com/de/PM/Produkte/Produktsortiment/Gebaeude/Sanitaerreinigung/Powerfix-Gel; SHA-256 5cb288d4a40aeb3c6b0657f1e9207958696fb5eeffc90dc5bc36531389348f92. No independent chemical-completeness or physical-container review asserted."
        }
      },
      "04031255045870": {
        "confirmed": true,
        "review": {
          "date": "2026-10-12",
          "reviewer": "Codex document/source audit",
          "basis": "Manufacturer-listed EAN association rechecked; https://www.kiehl-group.com/de/PM/Produkte/Produktsortiment/Gebaeude/Sanitaerreinigung/Powerfix-Gel; SHA-256 5cb288d4a40aeb3c6b0657f1e9207958696fb5eeffc90dc5bc36531389348f92. No independent chemical-completeness or physical-container review asserted."
        }
      },
      "04031255045924": {
        "confirmed": true,
        "review": {
          "date": "2026-10-12",
          "reviewer": "Codex document/source audit",
          "basis": "Manufacturer-listed EAN association rechecked; https://www.kiehl-group.com/de/PM/Produkte/Produktsortiment/Gebaeude/Sanitaerreinigung/Powerfix-Gel; SHA-256 5cb288d4a40aeb3c6b0657f1e9207958696fb5eeffc90dc5bc36531389348f92. No independent chemical-completeness or physical-container review asserted."
        }
      },
      "04031255035802": {
        "confirmed": true,
        "review": {
          "date": "2026-10-12",
          "reviewer": "Codex document/source audit",
          "basis": "Manufacturer-listed EAN association rechecked; https://www.kiehl-group.com/de/PM/Produkte/Produktsortiment/Gebaeude/Sanitaerreinigung/Powerfix-Gel; SHA-256 5cb288d4a40aeb3c6b0657f1e9207958696fb5eeffc90dc5bc36531389348f92. No independent chemical-completeness or physical-container review asserted."
        }
      }
    }
  },
  {
    "id": "kiehl-powerfix",
    "name": "Powerfix",
    "brand": "Kiehl",
    "gtins": [
      "04031255032184",
      "04031255036526",
      "04031255002569",
      "04031255012148"
    ],
    "ufi": "XS20-C0UR-Q00K-0DJG",
    "giscode": "GS60",
    "chemicalGroups": [
      "acid"
    ],
    "hazardStatements": [
      "H315",
      "H318"
    ],
    "casNumbers": [
      "7664-38-2",
      "7647-01-0",
      "69011-36-5"
    ],
    "ph": {
      "min": 0.5,
      "max": 0.5
    },
    "dataLane": "public_law",
    "sourceType": "sds",
    "provenance": {
      "sourceDocument": "Johannes Kiehl KG, Sicherheitsdatenblatt Powerfix",
      "sourceUrl": "https://www.kiehl-group.com/ix_pim_assets/doc/doc_Sicherheitsdatenblatt/j4005_sd_Powerfix_de.pdf",
      "sourceHost": "manufacturer",
      "revisionDate": "2022-12-12",
      "sha256": "ff65f5eaabe8c4811f2e475f42c43e75b77a9860d85cb649e420e4bd5016416f",
      "verificationDate": "2026-10-12",
      "gtinSource": "https://www.kiehl-group.com/de/PM/Produkte/Produktsortiment/Gebaeude/Sanitaerreinigung/Powerfix"
    },
    "activeIngredients": "Phosphorsäure 15 – < 20 % (CAS 7664-38-2), Salzsäure 1 – < 5 % (CAS 7647-01-0)",
    "descriptionDe": "Hochaktiver saurer Grundreiniger für den Sanitärbereich.",
    "descriptionEn": "Highly active acidic deep cleaner for sanitary areas.",
    "typicalUseDe": "Saure Grundreinigung im Sanitärbereich",
    "typicalUseEn": "Acidic deep cleaning in sanitary areas",
    "hazardsConfirmed": true,
    "completenessReviewed": false,
    "currentVersionChecked": true,
    "reviewMetadata": {
      "hazardsConfirmed": {
        "date": "2026-10-12",
        "reviewer": "Codex document/source audit",